{
  "id": "ley-21206",
  "tipo": "ley",
  "numero": "21206",
  "titulo": "PRORROGA LA VIGENCIA DE LA LEY Nº 20.234, QUE ESTABLECE UN PROCEDIMIENTO DE SANEAMIENTO Y REGULARIZACIÓN DE LOTEOS",
  "organismo": "MINISTERIO DE VIVIENDA Y URBANISMO",
  "fecha_publicacion": "2020-01-27",
  "estado": "derogada",
  "derogada_por": "ley-21477",
  "fuente": "https://www.bcn.cl/leychile/navegar?idNorma=1141619&idVersion=2020-01-27",
  "version": "2020-01-27",
  "hash": "sha256:00c6a4b089f49bafc1e3e7f37336c276e463fb92b11e3c4f21b2a144b87c0eaa",
  "texto": "LEY NÚM. 21.206\n \nPRORROGA LA VIGENCIA DE LA LEY Nº 20.234, QUE ESTABLECE UN PROCEDIMIENTO DE SANEAMIENTO Y REGULARIZACIÓN DE LOTEOS\n \n     Teniendo presente que el H. Congreso Nacional ha dado su aprobación al proyecto de ley originado en moción de los Honorables senadores señor Francisco Chahuán Chahuán, señora Carmen Gloria Aravena Acuña, y señores Carlos Montes Cisternas, Alejandro Navarro Brain y David Sandoval Plaza, y en moción del Honorable senador señor José García Ruminot y del ex senador señor Eugenio Tuma Zedan,\n      \n     Proyecto de ley:\n\n\"Artículo único.- Prorrógase por el plazo de cinco años, a contar del 31 de enero de 2020, el procedimiento simplificado de regularización a que se refiere el artículo 1° de la ley N° 20.234.\".\n\nY por cuanto he tenido a bien aprobarlo y sancionarlo; por tanto, promúlguese y llévese a efecto como Ley de la República.\n      \n     Santiago, 22 de enero de 2020.- SEBASTIÁN PIÑERA ECHENIQUE, Presidente de la República.- Cristián Monckeberg Bruner, Ministro de Vivienda y Urbanismo.\n     Lo que transcribo para su conocimiento.- Erwin Navarrete Saldivia, Subsecretario de Vivienda y Urbanismo (S)."
}
